<!DOCTYPE dataset SYSTEM "src/test/resources/dataSets/test.dtd">
<dataset>
    
    <AUDIT Id_Audit="1" Dt_Creation="2010-10-26 13:50:29" Status="COMPLETED"/>
    <AUDIT Id_Audit="2" Dt_Creation="2010-10-26 14:50:29" Status="COMPLETED"/>
    <AUDIT Id_Audit="3" Dt_Creation="2010-10-26 15:50:29" Status="COMPLETED"/>
    <AUDIT Id_Audit="4" Dt_Creation="2010-10-26 15:50:29" Status="COMPLETED"/>

    <WEB_RESOURCE DTYPE="SiteImpl" Id_Web_Resource="1" Label="NULL" Url="http://www.mock-url1.org/" Id_Audit="1" Id_Web_Resource_Parent="[NULL]" Rank="0"/>
    <WEB_RESOURCE DTYPE="PageImpl" Id_Web_Resource="5" Label="NULL" Url="http://www.mock-url1.org/" Id_Audit="2" Id_Web_Resource_Parent="[NULL]" Rank="1"/>
    <WEB_RESOURCE DTYPE="PageImpl" Id_Web_Resource="6" Label="NULL" Url="http://www.mock-url1.org/" Id_Audit="3" Id_Web_Resource_Parent="[NULL]" Rank="1"/>
    <WEB_RESOURCE DTYPE="PageImpl" Id_Web_Resource="7" Label="NULL" Url="http://www.mock-url1.org/" Id_Audit="4" Id_Web_Resource_Parent="[NULL]" Rank="1"/>
    <WEB_RESOURCE DTYPE="PageImpl" Id_Web_Resource="2" Label="NULL" Url="http://www.mock-url2.org/" Id_Web_Resource_Parent="1" Rank="1"/>
    <WEB_RESOURCE DTYPE="PageImpl" Id_Web_Resource="3" Label="NULL" Url="http://www.mock-url3.org/" Id_Web_Resource_Parent="1" Rank="2"/>
    <WEB_RESOURCE DTYPE="PageImpl" Id_Web_Resource="4" Label="NULL" Url="http://www.mock-url4.org/" Id_Web_Resource_Parent="1" Rank="3"/>
    
</dataset>