<!DOCTYPE dataset SYSTEM "src/test/resources/dataSets/test.dtd">
<dataset>
    
    <REFERENCE Id_Reference="1" Cd_Reference="01" Description="" Label="Ref 1.0" Rank="1" Url="http://www.mock-ref1.org/"/>
    <REFERENCE Id_Reference="2" Cd_Reference="02" Description="" Label="Ref 2.0" Rank="2" Url="http://www.mock-ref2.org/"/>

    <THEME Id_Theme="1" Cd_Theme="01" Label="Theme1" Rank="1"/>
    <THEME Id_Theme="2" Cd_Theme="02" Label="Theme2" Rank="2"/>
    <THEME Id_Theme="3" Cd_Theme="03" Label="Theme3" Rank="3"/>

    <CRITERION Id_Criterion="1" Reference_Id_Reference="1" Theme_Id_Theme="1" Cd_Criterion="0101" Description="Critere 1.1" Label="1.1" Url="http://www.mock-criterion1.1.org/" Rank="1"/>
    <CRITERION Id_Criterion="2" Reference_Id_Reference="1" Theme_Id_Theme="2" Cd_Criterion="0102" Description="Critere 1.2" Label="1.2" Url="http://www.mock-criterion1.2.org/" Rank="2"/>
    <CRITERION Id_Criterion="3" Reference_Id_Reference="2" Theme_Id_Theme="3" Cd_Criterion="0103" Description="Critere 1.3" Label="1.3" Url="http://www.mock-criterion1.3.org/" Rank="3"/>
    <CRITERION Id_Criterion="4" Reference_Id_Reference="2" Theme_Id_Theme="3" Cd_Criterion="0104" Description="Critere 1.4" Label="1.4" Url="http://www.mock-criterion1.4.org/" Rank="4"/>

    <SCOPE Id_Scope="1" Code="page" Description="page" Label="Page" />
    <SCOPE Id_Scope="2" Code="site" Description="site" Label="Site" />
    
    <LEVEL Id_Level="1" Cd_Level="Bz" Description="Level1" Label="Level1" Rank="1"/>
    <LEVEL Id_Level="2" Cd_Level="Ar" Description="Level2" Label="Level2" Rank="2"/>
    <LEVEL Id_Level="3" Cd_Level="Or" Description="Level3" Label="Level3" Rank="3"/>

    <TEST Id_Test="1" Cd_Test="10101" Description="Test 1.1.1" Label="1.1.1" Rank="1" Weight="1.0" Id_Criterion="1" Id_Scope="2" Id_Level="1" No_Process="false"/>
    <TEST Id_Test="2" Cd_Test="10102" Description="Test 1.1.2" Label="1.1.2" Rank="2" Weight="1.0" Id_Criterion="2" Id_Scope="1" Id_Level="1" No_Process="false"/>
    <TEST Id_Test="3" Cd_Test="10103" Description="Test 1.1.3" Label="1.1.3" Rank="3" Weight="1.0" Id_Criterion="1" Id_Scope="2" Id_Level="1" No_Process="false"/>
    <TEST Id_Test="4" Cd_Test="10104" Description="Test 1.1.4" Label="1.1.4" Rank="4" Weight="1.0" Id_Criterion="2" Id_Scope="1" Id_Level="1" No_Process="false"/>
    <TEST Id_Test="5" Cd_Test="10105" Description="Test 1.1.5" Label="1.1.5" Rank="5" Weight="1.0" Id_Criterion="1" Id_Scope="1" Id_Level="1" No_Process="false"/>
    <TEST Id_Test="6" Cd_Test="10106" Description="Test 1.1.6" Label="1.1.6" Rank="6" Weight="1.0" Id_Criterion="2" Id_Scope="1" Id_Level="1" No_Process="false"/>
    <TEST Id_Test="7" Cd_Test="10107" Description="Test 1.1.7" Label="1.1.7" Rank="7" Weight="1.0" Id_Criterion="2" Id_Scope="1" Id_Level="2" No_Process="false"/>
    <TEST Id_Test="8" Cd_Test="10108" Description="Test 1.1.8" Label="1.1.8" Rank="8" Weight="1.0" Id_Criterion="1" Id_Scope="1" Id_Level="2" No_Process="false"/>
    <TEST Id_Test="9" Cd_Test="10109" Description="Test 1.1.9" Label="1.1.9" Rank="9" Weight="1.0" Id_Criterion="2" Id_Scope="1" Id_Level="2" No_Process="false"/>
    <TEST Id_Test="10" Cd_Test="10110" Description="Test 1.1.10" Label="1.1.10" Rank="10" Weight="1.0" Id_Criterion="2" Id_Scope="1" Id_Level="1" No_Process="false"/>
    <TEST Id_Test="11" Cd_Test="10111" Description="Test 1.1.11" Label="1.1.11" Rank="11" Weight="1.0" Id_Criterion="3" Id_Scope="1" Id_Level="1" No_Process="false"/>
    <TEST Id_Test="12" Cd_Test="10112" Description="Test 1.1.12" Label="1.1.12" Rank="12" Weight="1.0" Id_Criterion="3" Id_Scope="1" Id_Level="1" No_Process="false"/>
    <TEST Id_Test="13" Cd_Test="10113" Description="Test 1.1.13" Label="1.1.13" Rank="13" Weight="1.0" Id_Criterion="3" Id_Scope="1" Id_Level="1" No_Process="false"/>
    <TEST Id_Test="14" Cd_Test="10114" Description="Test 1.1.14" Label="1.1.14" Rank="14" Weight="1.0" Id_Criterion="4" Id_Scope="1" Id_Level="2" No_Process="false"/>
    <TEST Id_Test="15" Cd_Test="10115" Description="Test 1.1.15" Label="1.1.15" Rank="15" Weight="1.0" Id_Criterion="4" Id_Scope="1" Id_Level="2" No_Process="false"/>

    <AUDIT Id_Audit="1" Dt_Creation="2010-10-26 13:50:29" Status="COMPLETED"/>
    <AUDIT Id_Audit="2" Dt_Creation="2010-10-26 14:50:29" Status="COMPLETED"/>
    
    <WEB_RESOURCE DTYPE="PageImpl" Id_Web_Resource="1" Label="NULL" Url="http://www.mock-url.org/1.html" Id_Audit="1" Rank="1"/>
    <WEB_RESOURCE DTYPE="PageImpl" Id_Web_Resource="2" Label="NULL" Url="http://www.mock-url.org/2.html" Id_Audit="2" Rank="1" />

    <PROCESS_RESULT DTYPE="DefiniteResultImpl" Id_Process_Result="1" Definite_Value="NEED_MORE_INFO" Element_Counter="2" Id_Web_Resource="1" Id_Test="1" Id_Audit_Net_Result="1" Id_Audit_Gross_Result="1"/>
    <PROCESS_RESULT DTYPE="DefiniteResultImpl" Id_Process_Result="2" Definite_Value="PASSED" Element_Counter="2" Id_Web_Resource="1" Id_Test="2" Id_Audit_Net_Result="1" Id_Audit_Gross_Result="1"/>
    <PROCESS_RESULT DTYPE="IndefiniteResultImpl" Id_Process_Result="3" Indefinite_Value="EMPTY" Element_Counter="2" Id_Web_Resource="1" Id_Test="3" Id_Audit_Net_Result="1" Id_Audit_Gross_Result="1"/>
    <PROCESS_RESULT DTYPE="DefiniteResultImpl" Id_Process_Result="4" Definite_Value="NEED_MORE_INFO" Element_Counter="2" Id_Web_Resource="1" Id_Test="4" Id_Audit_Net_Result="1" Id_Audit_Gross_Result="1"/>
    <PROCESS_RESULT DTYPE="DefiniteResultImpl" Id_Process_Result="5" Definite_Value="PASSED" Element_Counter="2" Id_Web_Resource="1" Id_Test="5" Id_Audit_Net_Result="1" Id_Audit_Gross_Result="1"/>
    <PROCESS_RESULT DTYPE="IndefiniteResultImpl" Id_Process_Result="6" Indefinite_Value="EMPTY" Element_Counter="2" Id_Web_Resource="1" Id_Test="6" Id_Audit_Net_Result="1" Id_Audit_Gross_Result="1"/>
    <PROCESS_RESULT DTYPE="DefiniteResultImpl" Id_Process_Result="7" Definite_Value="NEED_MORE_INFO" Element_Counter="2" Id_Web_Resource="2" Id_Test="1" Id_Audit_Net_Result="2" Id_Audit_Gross_Result="2"/>
    <PROCESS_RESULT DTYPE="DefiniteResultImpl" Id_Process_Result="8" Definite_Value="FAILED" Element_Counter="2" Id_Web_Resource="1" Id_Test="7" Id_Audit_Net_Result="1" Id_Audit_Gross_Result="1"/>
    <PROCESS_RESULT DTYPE="IndefiniteResultImpl" Id_Process_Result="9" Indefinite_Value="EMPTY" Element_Counter="2" Id_Web_Resource="1" Id_Test="8" Id_Audit_Net_Result="1" Id_Audit_Gross_Result="1"/>
    <PROCESS_RESULT DTYPE="DefiniteResultImpl" Id_Process_Result="10" Definite_Value="FAILED" Element_Counter="2" Id_Web_Resource="1" Id_Test="9" Id_Audit_Net_Result="1" Id_Audit_Gross_Result="1"/>
    <PROCESS_RESULT DTYPE="DefiniteResultImpl" Id_Process_Result="11" Definite_Value="NOT_APPLICABLE" Element_Counter="2" Id_Web_Resource="2" Id_Test="2" Id_Audit_Net_Result="2" Id_Audit_Gross_Result="2"/>
    <PROCESS_RESULT DTYPE="IndefiniteResultImpl" Id_Process_Result="12" Indefinite_Value="EMPTY" Element_Counter="2" Id_Web_Resource="1" Id_Test="10" Id_Audit_Net_Result="1" Id_Audit_Gross_Result="1"/>

</dataset>